eq,label
【买100送50200送100】一次性口罩防晒防尘透气防花絮男女pm2.5,鞋包
10万米 可看月亮环形山升级双筒望远镜高倍高清微光夜视手机拍照,运动户外
全自动重力支架车载出风口手机支架金属汽车导航仪旋转支架,汽车配件
纯棉汽车掸子 除尘蜡刷擦车用拖把 铝合金伸缩刷子,汽车配件
汽车掸子蜡 汽车蜡 液体拖把油蜡刷汽车养护用品500ml,汽车配件
汽车用后视镜小圆镜360度可调 倒车盲点无边高清广角 对装,汽车配件
汽车高清无边小圆镜 可调节盲点镜倒车镜玻璃方形广角镜,汽车配件
CLS新款户外折叠水桶双层沥水篮洗菜洗碗桶野营伸缩钓鱼桶渔具包,运动户外
登山户外折叠椅航空铝合金靠背椅子钓鱼椅火车凳马扎,运动户外
出口便携折叠保温箱户外野餐60L大容量收纳箱食品恒温箱车载冰箱,运动户外
免打孔香皂盒创意沥水肥皂盒壁挂卫生间大号肥皂架浴室置物架,百货
出口韩国户外炊具套装野炊厨具便携201不锈钢感性手提包野餐包,运动户外
出口韩国户外防晒中小型犬宠物窝专用狗窝猫窝小狗帐篷,运动户外
户外BBQ手套野营生火烧烤牛皮耐高温隔热加厚加长焊接防护手套,运动户外
户外TPU充气床超轻充气垫便携帐篷睡垫蛋槽加厚防潮垫,运动户外
户外便携式焚火架折叠烧烤炉不锈钢点炭生火炉超轻网架取暖柴火炉,运动户外
户外不锈钢筷子筒套装野营装备旅游便携组合餐具17件套野餐收纳包,运动户外
户外登山折叠椅钓鱼凳子大号野餐烧烤便携写生椅钓鱼椅火车凳马扎,运动户外
户外铝合金折叠桌出口韩国日本自驾游便携野餐烧烤桌子铝板桌,运动户外
户外野营取暖罩秋冬季迷你取暖炉红外帐篷取暖器不锈钢供暖罩,运动户外
澳洲原瓶进口红酒 圣骑庄园银袋鼠混酿干红750ml葡萄酒 6瓶装,食品
户外野营睡袋加宽旅行午休信封带帽便携加厚室内秋冬保暖隔脏睡袋,运动户外
户外帐篷野营纱网透气防晒四面门窗通风防虫3-4人露营钓鱼帐篷,运动户外
户外折叠收纳篮多功能收纳筐手提篮车载置物篮整理箱PP塑料整理箱,运动户外
户外折叠小凳子7075铝合金成人迷你便携烧烤钓鱼椅子火车凳小马扎,运动户外
户外折叠椅子7075铝合金钓鱼椅烧烤凳折叠凳便携火车凳野营小马扎,运动户外
瑜伽圈普拉提圈开肩家用瑜伽圈魔力环瘦腿初学者后弯瘦手臂健身正,运动户外
户外抓绒睡袋野营旅行内胆空调被保暖四季露营午休膝盖毯隔脏睡袋,运动户外
派普正品瑜伽铺巾加厚加宽瑜伽垫毛巾瑜珈毯子防滑垫吸汗瑜伽布巾,运动户外
加厚加粗纯净水桶支架折叠桶装水架子压水器台式简易倒置饮水机架,运动户外
尚调瑜伽弹力带健身女男士力量训练拉力带运动用品阻力拉伸健身带,运动户外
浴室厨房吸盘肥皂盒壁挂式沥水香皂盒免打孔收纳皂盒置物架,百货
小型宠物帐篷猫窝狗窝印第安可拆洗帆布面料木质猫咪狗屋宠物窝,运动户外
达摩轮瑜伽圈瑜伽轮家用普拉提圈套装健身器材家用后弯腰辅助用品,运动户外
新款户外不锈钢铜锤帐篷天幕地钉锤拔钉器红铜大号多功能野营榔头,运动户外
新款户外炊具五件套装野营烧烤不锈钢刀具菜板野餐包烤肉简易厨具,运动户外
新款户外烧烤桌可拼接网桌野营便携多功能折叠桌自驾游便携野餐桌,运动户外
新款户外野餐垫旅行包多功能防水布折叠收纳帐篷防潮垫地布沙滩垫,运动户外
新铸铁锅炖锅日本煲汤锅户外野炊烧水吊锅炖肉烤鸡生铁火锅荷兰锅,运动户外
TPU旅行充气枕睡枕旅游空气枕头午睡护颈腰靠,运动户外
热销家居服懒人衣套头电视毯保暖被防寒服连帽抓绒衣加厚款,运动户外
帆布吊床户外秋千加厚野营休闲单双人情侣寝室宿舍室内吊椅,运动户外
带手柄强力浴缸刷 浴室瓷砖刷 厨房工具去污清洁刷子海绵擦,百货
【买一送一】男士保暖背心无痕加绒加厚发热紧身修身打底无袖背心坎肩,男装
飞机杯男用炮娘处女宫撸阴经锻炼自慰器自卫慰倒模成人情趣,医疗保健
【买一送一】男士保暖背心双面绒秋冬季加厚加绒打底修身无袖内衣单层马甲,男装
单棉可选佰特步落正品男鞋冬季运动鞋子男韩版潮流男士休闲鞋SWK,鞋包
智力快车 触屏拍照定位儿童电话手表智能电话手表学生手机男孩女孩生活防水,3C数码
男鞋夏季透气运动鞋编织休闲鞋男网红鞋男百搭韩版时尚潮流休闲鞋,鞋包
韩域丹依娜秋冬新款韩版时尚宽松显瘦萝卜裤加厚毛呢哈伦裤羊绒九分休闲裤潮裤子,女装
女用自卫慰器自慰自动抽插仿真阳具成人情趣性用品女性自尉假阴茎,医疗保健
穿戴式仿真假阳具内裤阴茎les拉拉同性恋jj成人男女用情趣性用品,医疗保健
女性高潮液人体润滑油剂成人房事夫妻性冷淡专用用品快感增强液,医疗保健
妮维雅润唇膏男女士学生保湿补水,美妆
狼牙棒男用阴茎套成人加长套情趣用品水晶加粗带刺男性增长增大粗,医疗保健
赛亿品牌正品取暖器家用办公室宿舍速热可手提安全电暖炉双档调节900W,3C数码
妮维雅护手霜润手霜保湿补水防干裂男女秋冬美白朱一龙同款,美妆
情趣用品SM刑具成人玩具用品激情用具调教滴蜡低温蜡烛性工具合欢,医疗保健
强力魔力贴无痕毛巾架浴室卫生间毛巾挂毛巾架,百货
妮维雅刮胡须泡沫剃须泡泡男士刮胡子膏软化胡须200ml,美妆
【梁山泊】红心起沙流油20枚装咸鸭蛋礼盒 五香真空包装咸鸭,食品
妮维雅爽身走珠液男女士香体露爽身走珠液腋下持久止汗淡香去狐臭,美妆
【梁山泊】厂家批发无铅松花皮蛋20枚礼盒装 山东特产实心变蛋,食品
厂家直销 20枚大蛋礼盒装（70g） 北部湾红树林 烤海鸭蛋 咸蛋,食品
成人情趣用具性用品跳蛋女内裤骚玩具自慰器高潮震动棒性感舔阴,医疗保健
海鸭蛋咸鸭蛋正宗红树林特产烤鸭蛋非北部湾咸蛋,食品
【限时秒杀100台】户外无线蓝牙音箱手提便携式插卡音响U盘低音炮,3C数码
五芳斋年货食品八宝饭390g*3豆沙馅,食品
泊泉雅 蚕丝蛋白柔肤水补水保湿滋润控油收缩毛孔舒缓肌肤护,美妆
家居墙上置物架免打孔不锈钢置物架厨房壁挂式吸盘收纳架,百货
【买二送一】五芳斋红枣燕麦小米粥早餐粥代餐粥粗粮粥150g袋装,食品
跳蛋女用品自慰舔阴器成人性玩具女性自尉棒内裤女学生用情趣用具,医疗保健
新品五芳斋大肉粽 真空140克*2共280g 新鲜大肉粽子嘉兴特产,食品
冬季新款皮衣 商务男士韩版翻领加绒加厚仿绵羊皮皮衣,男装
橄榄X6 无线蓝牙音箱 便携音响迷你炫彩插卡小音箱电脑低音炮适用小米华为,3C数码
【婚宴/宴请/拜年送礼】江苏洋河镇九五至之尊浓香型52度白酒批发团购婚宴福利宴请用酒,食品
洞藏老酒茅台镇酱香型白酒整箱批发53度粮食酒原浆酒厂家酒水特价,食品
汽车轮毂刷 轮胎刷 洗车轮胎清洁刷 洗车刷子 汽车清洁用品,汽车配件
车载垃圾桶侧门座椅后背椅背垃圾篓置物桶大号车用垃圾箱,汽车配件
明星鹿晗同款口罩黑色防尘透气可水洗防雾霾秋冬季口罩男口罩女03,鞋包
车载椅背开放式垃圾桶 侧门垃圾桶 后背置物桶,汽车配件
冬季中老年加绒超厚休闲裤男紧腿羊羔绒运动裤男士大码外穿棉裤,男装
【精品礼盒送礼有面】手工精选青海野生黑枸杞 黑枸杞子礼品礼盒瓶装批发 送礼,食品
汽车前排座椅储物挡网兜 通用双层储物网储物袋收纳袋,汽车配件
【德国品牌 质保2年】铂瑞TB005成人儿童电动牙刷超声波智能软毛,3C数码
汽车防静电消除器接地条车载悬挂式去除静电线橡胶棒拖地带车用品,汽车配件
【多买多优惠】车载香水汽车出风口车用香薰香膏车内用品创意持久淡香装饰摆件 单个装,汽车配件
新款中年男士外套冬季加绒加厚夹克男春秋季休闲衣服爸爸冬装外套,男装
吸盘不锈钢沥水置物架壁挂式浴室收纳置物架,百货
【磁悬浮动力 德国品牌】铂瑞TB012电动牙刷充电式超声波成人防水,3C数码
机乐堂2600/5200/10000毫安移动电源智能快充便携小巧迷你充电宝,3C数码
飞机杯男用阴茎拉伸按摩私处降敏训练器男性持久粗大锻炼器处女,医疗保健
【德国品牌 质保2年】铂瑞BR-X1成人儿童电动牙刷超声波智能软毛,3C数码
车载香水摆件汽车车内饰品座式创意车用香薰,汽车配件
包皮阻复环矫正过长环切器男用锁精环阴经套成人情趣性用品锻炼割,医疗保健
车载加湿器补水汽车喷雾器车内空气净化迷你氧吧车用香熏机,汽车配件
震动锁精环阴茎套男用抽插持久情趣高潮男女共用器性工具久战防射,医疗保健
布卢图斯 真无线双耳蓝牙耳机 运动跑步迷你耳塞式 重低音立体声手机通用蓝牙耳机,3C数码
布卢图斯 无线双耳蓝牙耳机迷你隐形超小4.1 运动立体声手机通用无线双耳挂耳式蓝牙耳机,3C数码
形象美黄金晶透滋润眼霜 眼部精华补水保湿滋润去黑眼圈,美妆
志高 儿童电动牙刷 声波震动软毛刷头电动牙刷,3C数码
雷锋帽男帽子女冬季韩版东北防寒帽冬天骑车护耳加厚防风保暖棉帽,运动户外
【秒杀亏200件】雷锋帽男女士秋冬季保暖骑车套头帽东北老人加厚棉帽子男,运动户外
志高 电动牙刷感应充电式成人声波震动牙刷 青春活力型,3C数码
羽绒服男士2018新款韩版潮牌中长款轻薄连帽青少年白鸭绒休闲外套,男装
人体润滑油剂女用房事夫妻水溶性私处抽插阴道液成人调情趣男用品,医疗保健
防尘口罩男女夏季透气呼吸阀打磨防工业粉尘防雾霾一次性头戴口罩02,鞋包
【限时折扣】脂流茶24小包X5克 花茶代加工袋泡茶养生茶 定制冬瓜荷叶花茶,食品
小怪兽跳蛋静音无线遥控女用品小恶魔自慰情趣远程用具玩具学生用,医疗保健
跳蛋女用品自慰舔阴器成人性玩具女性自尉棒内裤女学生用情趣用具,医疗保健
跳蛋女激情性用品舔阴器学生房趣女用性感情趣骚夫妻性用品女挑逗,医疗保健
金灶 全智能电茶壶全自动上水电热水壶电茶炉电水壶,3C数码
狼牙男用阴茎套龟头棒高潮四性兽情趣性用品工具用具阳具加长加粗,医疗保健
明星鹿晗同款口罩黑色冬季防尘透气可水洗口罩男口罩女防雾霾口罩,运动户外
【品依诺】95棉加绒加厚高领长袖女上衣2019新款韩版内搭衣服百搭T恤秋冬打底衫,女装
金灶 全自动上水电热水壶电茶壶抽水茶具 全智能电茶炉,3C数码
卫生间马桶刷带底座套装免打孔吸壁式马桶刷架洁厕置物架,百货
双层带抽屉懒人果盘 手机支架果屑盘 卡通小熊,百货
桃花醉高潮女性快感液情趣情欲仙高潮女液激情快感性冷淡专用,医疗保健
金灶 全智能茶艺炉涌泉式全自动上水电热水壶电茶壶,3C数码
【品依诺】毛衣马甲加绒衬衫韩版百搭显瘦秋季针织马夹女背心针织衫,女装
卡通抽绳束口便携密封防水衣物整理收纳袋三件套,百货
单鞋棉鞋可选户外休闲旅游鞋登山鞋慢跑鞋防水防滑运动工作劳保鞋,鞋包
另类玩具推油床单sm情趣用品高潮激情用具合欢性工具欲仙情侣系列,医疗保健
金灶 自动上水电热水壶加抽水器茶具电茶壶 热水壶 T-22A 黑色,3C数码
印度神油廷时喷剂持久男用延时延迟延长抽插时间正品外用湿巾神,医疗保健
智能玻璃煮茶器 黑茶花茶煮茶壶 养生电茶壶HT-560 香槟金0.8L,3C数码
智能机器人玩具对话胡巴英语学习机男女孩陪伴儿童教育学习早教,3C数码
【限时秒杀】托玛琳自发热护膝护膝保暖老寒腿男女士四季加热护腿,运动户外
先科大品牌取暖器小太阳电暖器迷你办公室学生宿舍电火盆静音烤炉600W,3C数码
【限时秒杀】护腰带男女磁疗保暖钢板腰托自发热腰椎间盘突出腰肌劳损腰疼神器,运动户外
懒人手机支架iPhone桌面架ipad夹看电视直播ipad6架子mini折叠防滑通用手机座,3C数码
自发热护膝男女士秋冬保暖防寒护膝盖关节老寒腿老人四季保暖护膝,运动户外
护耳口罩二合一保暖防寒冬季防风加绒加厚男女士儿童骑行学生韩版,运动户外
浴室吸盘牙刷置物架免打孔洗漱杯牙刷架套装壁挂涑口杯牙刷架,百货
托玛琳自发热护膝远红外关节保暖护膝盖老寒腿磁疗防寒中老年男女,运动户外
泊泉雅丝滑嫩肤 遮瑕液遮瑕隔离立体修颜 粉底液滋养保湿,美妆
2018冬季新款儿童卡通护耳口罩纯棉内里小熊学生二合一保暖口罩,运动户外
2018新款冬季男士护耳毛绒二合一保暖口罩时尚胡子刺绣骑行口罩,运动户外
冬季保暖口罩男女时尚韩版表情护耳二合一口罩骑行防风潮,运动户外
自发热护腰带秋冬磁疗透气加宽腰间盘突出腰肌劳损男女钢板腰托,运动户外
冬季新款女士不倒绒时尚简约纯色纽扣装饰加绒触屏保暖手套,运动户外
冬季新款幼儿园宝宝双层加厚彩色条纹针织保暖儿童手套,运动户外
人初油延时喷剂男用品正品延迟印度持久神油喷雾男士延长男性保健,医疗保健
【秒杀】托玛琳自发热磁疗保健透气护腰带腰间盘腰肌腰部酸痛腰托缓解男女,运动户外
牛津布手提保温便当包 饭盒收纳袋,百货
冬季骑车口罩面罩二合一透气成人防寒防尘防雾霾防冻护耳朵加绒厚,运动户外
防风保暖防寒户外手套男式全指皮革冬季新品男手套,运动户外
新款秋冬季男士保暖手套时尚针织毛线手套户外骑行手套,运动户外
女士冬季时尚骑行保暖针织手套,运动户外
四杆位可折叠抹布架 沥水杯架,百货
韩婵玻尿酸补水保湿嫩肤滋养洗面奶 洁面乳清洁 泡沫洁面,美妆
韩版情侣冬季三合一口罩男女纯棉护耳骑车保暖防寒防风口罩,运动户外
V88儿童电话手表智能定位多功能手机学生防水小男女孩子可爱运动初中生成人插卡手环通话,3C数码
通用宝宝水龙头延伸器延长器儿童洗手神器卡通加长管防溅头导水槽,百货
飞机杯男用自慰自尉器智能全自动撸电动抽插伸缩成人情趣性用品打,医疗保健
长柄软毛洗澡浴刷 二合一搓澡浴擦 尼龙搓澡神器搓背器浴刷子,百货
飞机杯男用智能加温全自动伸缩加热活塞式男人自卫慰器发声自慰杯,医疗保健
帐篷户外3-4全自动双人单人2人加厚野营防雨露营野外家庭蚊帐儿童,运动户外
成人用品男用自尉器真人阴臀臀部倒模男人自卫慰器真阴双穴飞机杯,医疗保健
户外加厚帆布宿舍单人吊床野营休闲室内儿童送绳袋假日旅游,运动户外
可爱卡通儿童男女学生饭盒 便当盒 方形双层迷你小饭盒保鲜盒,百货
户外野餐垫野营折叠防潮爬爬垫防水帐篷地垫儿童沙滩垫,运动户外
全自动帐篷多人户外3-5人六角大帐篷户外露营野营防雨,运动户外
沙滩防潮垫双面铝膜帐篷地垫2米X2米户外地布加厚eva铝箔野餐野营爬行,运动户外
户外双人野营全自动双层弹簧3-4人沙滩露营帐篷,运动户外
3-4人户外全自动帐篷野营沙滩速开迷彩双人情侣露营,运动户外
护腰带男女护腰夏薄款磁疗腰围自发热保暖腰间盘腰肌劳损钢板腰托,运动户外
户外野营折叠全自动帐篷3-4人沙滩简易速开双人,运动户外
户外折叠全自动野营帐篷3-4人沙滩弹簧速开,运动户外
全自动多人双层5-8人六角大帐篷户外露营野营防雨,运动户外
自动充气垫可拼接成双人九点自冲垫加厚防潮户外野营睡垫,运动户外
护腰带保暖磁疗男女钢板自发热腰托腰围腰椎间盘突出腰肌劳损腰疼,运动户外
飞机杯男用自尉器男性阴经锻炼自慰撸管神器性玩具用品学生撸打男,医疗保健
豪华家用电动跑步机 多功能静音减震 大型健身器材,运动户外
家用款小型跑步机多功能迷你走步机静音减震加长跑带健身器材,运动户外
【过年拜年送礼】阿婆家的高档年货礼盒零食大礼包薯片麻薯过年回家送礼,食品
家用小型机械跑步机多功能静音迷你可折叠减肥锻炼运动健身器,运动户外
机械跑步机家用迷你小型跑步机多功能静音折叠健身器材,运动户外
冬季自发热护膝秋季保暖关节老寒腿老人防寒薄款护腿套夏季男女,运动户外
自发热护膝保暖透气老寒腿护膝盖护腿套护关节护膝套男女秋冬季,运动户外
【限时秒杀】自发热托玛琳保暖护膝护腰护颈老寒腿风湿腿舒缓疼痛运动护膝男女,运动户外
年货零食饼干 金元宝 福星高照 招财进宝 过年摆设果盘送礼结婚,食品
自发热护膝保暖护膝套护膝盖护腿套老寒腿男女士秋冬款,运动户外
Cleye7075铝合金折叠杖5节登山杖户外便携手杖男女款厂家,运动户外
艾灸贴正品蕲艾艾宫寒艾灸条艾草贴艾叶艾绒艾贴艾柱家用肩颈热灸祛湿宫暖艾贴,百货
吸盘收纳毛巾置物架厨房卫浴通用不锈钢置物架,百货
Cleye超轻7075航空铝合金伸缩户外登山杖外锁手杖行山杖,运动户外
自发热磁疗护膝女男护腕护颈护腰带鞋垫男女护踝发热运动保健护具,运动户外
Cleye超轻7075航空铝合金伸缩户外登山杖外锁手杖行山杖,运动户外
飞机杯男用学生自尉器撸管丝袜便携性工具阴经锻炼成人情趣自慰蛋,医疗保健
Cleye超轻7075航空铝合金伸缩户外登山杖外锁手杖行山杖,运动户外
【过年拜年送礼必备】润之禧 年货礼盒装 坚果干果炒货零食品大礼包 春节过年礼品送礼,食品
Cleye超轻7075航空铝合金伸缩户外登山杖外锁手杖行山杖,运动户外
成人学生隐形自慰蛋男用便携式一次性飞机杯神器手动撸情趣性用品,医疗保健
冬季PM25呼吸阀口罩男女成人保暖防尘透气防雾霾口罩,运动户外
【限时秒杀】四季通用男女士自发热护腰带透气运动保暖宫腰椎间盘突出医用腰托,运动户外
飞机杯口男用阴茎训练器成人情趣用品撸管龟头训练自慰器名器,医疗保健
防尘保暖防寒蕾丝口罩女耳罩耳套护耳冬季骑行,运动户外
【聚划算一个才不到3.8元】润之禧 鲜肉粽子 浙江嘉兴特产 真空棕子 端午节 粽子批发,食品
纯棉立体口罩防尘保暖防护防寒男女耳罩耳套护耳冬季骑行新款,运动户外
自发热护腰带磁疗热灸男女士保暖暖宫护胃腰间盘劳损腰椎间盘护腰带,运动户外
冬季口罩女士耳罩围脖新款耳套防尘保暖防寒骑行护耳面罩新款,运动户外
滇虹康王去屑止痒洗发水止痒控油洗发露清爽平衡青蒿洗剂70ML正品,百货
冬季口罩女士耳罩围脖新款耳套印花防尘保暖防寒骑行护耳纯棉,运动户外
自发热护腰带磁疗热灸腰间盘劳损腰疼防寒保暖暖宫塑身收腹带腰托,运动户外
免打孔墙上厨房置物架卫生间吸盘收纳储物架,百货
儿童口耳罩二合一卡通冬季保暖口罩时尚骑行加厚小孩护耳口罩,运动户外
儿童女口罩耳罩冬季二合一新款卡通耳套加厚防尘保暖防寒护耳,运动户外
防尘保暖防寒防护口罩男耳罩骑行耳套护耳纯棉冬季二合一新款,运动户外
防尘保暖防寒口罩男女耳罩耳套护耳立体全包骑行加厚冬季新款,运动户外
男用阴茎训练口袋妖精迷你便携丝袜套飞机杯自慰器成人性用品撸蛋,医疗保健
防尘保暖防寒蕾丝口罩女耳罩卡通耳套护耳纯棉冬季二合一新款,运动户外
口罩女冬季时尚韩版男个性时尚新款防尘保暖防寒护耳罩二合一,运动户外
口罩女耳罩卡通冬季二合一新款耳套防尘保暖防寒韩版护耳纯棉,运动户外
龟头锻练飞机杯男用品降低阴茎敏感训练按摩器成人自慰性情趣用具,医疗保健
甩脂机抖抖机多功能减肥燃脂按摩器瘦腰瘦肚子瘦大小腿瘦身腰带,运动户外
吸盘置物架浴室洗漱台毛巾收纳架免打孔墙上置物架,百货
减肥甩脂机抖抖机充电款燃脂瘦身腰带震动健身仪瘦腿瘦腰男女可用,运动户外
女用品自慰假阳具情趣用具自尉震动棒性高潮自卫慰器女性成人玩具,医疗保健
康丽高清无线双人20加厚手舞足蹈电视电脑两用体感跳舞毯,运动户外
雷霆蜜豆乳房刺激震动棒挑逗器女用按摩阴蒂刺激器高潮自卫慰器,医疗保健
无线手舞足蹈跳舞毯单人电视接口电脑两用体感跳舞机,运动户外
单人有线跳舞毯电脑专用瑜伽健身跳舞机,运动户外
高清跳舞毯双人电视接口电脑两用体感游戏手舞足蹈跳舞机,运动户外
新款无线感应瑜伽跳舞毯单人电脑专用瑜伽健美操跳舞机,运动户外
跳舞毯双人无线电视电脑两用瑜伽体感游戏加厚家用跳舞机,运动户外
甩脂机抖抖机多功能减肥燃脂按摩器瘦腰瘦肚子瘦大小腿瘦身腰带,运动户外
韩国LEADERS丽得姿润美面膜 强化补水/祛痘修复/紧致提拉,海淘
【中粮名庄荟 】奔富红酒 澳洲进口设拉子赤霞珠干红葡萄酒 750ML*6支整箱装,食品
减肥甩脂机抖抖机充电款燃脂瘦身腰带震动健身仪瘦腿瘦腰男女可用,运动户外
儿童呼啦圈可拆卸成人体育运动用品健身器材塑料体操呼啦圈,运动户外
儿童呼啦圈可拆卸塑料呼拉圈中小学生拼装健身器材呼啦圈,运动户外
呼啦圈男女成人可加重塑料健身器材体操圈拆卸拼接按摩呼拉圈,运动户外
新品呼啦圈海绵成人拼接塑料健身器材收腹女瘦按摩呼啦圈,运动户外
7x18袖珍单筒望远镜户外观景便携迷你高倍高清望眼镜,运动户外
1030X25连续变倍单筒微光夜视高清高倍望远镜,运动户外
通用20倍手机长焦镜头20金属望远镜头外置特效摄像镜头,运动户外
新款通用18倍金属外置长焦镜头高倍高清手机拍照望远镜头,运动户外
子弹头高倍高清8倍长焦手机单筒望远镜袖珍便携带夹子,运动户外
卫生间落地四层置物架 浴室置地式收纳架,百货
迷你袖珍微型单筒望远镜成龙用间谍望远镜25X175拇指超微型,运动户外
8x21迷你红圈单筒望远镜,运动户外
高清长焦手机镜头单筒望远镜通用18倍变焦外置摄像头演唱会,运动户外
望远镜手机望远12X50高清高倍户外微光夜视单筒拍照望眼镜,运动户外
8x21双筒望远镜长焦通用镜头,运动户外
76700天文望远镜高清高倍微光夜视观星观景,运动户外
入门天文望远镜F36050升级版带寻星镜高清高倍单筒,运动户外
高清大屏幕双筒数码夜视仪拍照录像红外夜视黑白两用狩猎安防巡逻,运动户外
红外线军迷头戴头盔式高清夜视仪望远镜美式单筒PVS14数码夜视仪,运动户外
儿童专业天文望远镜F30070M单筒望远镜配三脚架学生礼物,运动户外
澳大利亚进口红酒 奔富Penfolds BIN128 干红酒葡萄酒 红酒整箱-750ml*6支,食品
50360N学生儿童小型单筒天文观远镜优质入门天文望远镜,运动户外
星特朗80DX太空天文望远镜深空成人高倍高清专业观星学生初学入门,运动户外
星特朗80DX太空天文望远镜深空成人高倍高清专业观星学生初学入门,运动户外
星特朗80DX太空天文望远镜深空成人高倍高清专业观星学生初学入门,运动户外
仿真假阳具自尉自慰舔阴器震动棒高潮成人情趣女用品超大粗女性性,医疗保健
雷霆女用舌浪震动棒G点按摩加温充电自慰蛋棒女性情趣用品,医疗保健
AV震动棒女用品自慰舔阴器情趣用高潮阴蒂刺激成人按摩性工具玩具,医疗保健
REGAIL718A铝合金羽毛球拍两支装训练羽毛球训练拍批发,运动户外
REGAIL826羽毛球拍铁合金羽毛球拍羽毛球拍加球练习热销球拍,运动户外
REGAIL羽毛球拍6504儿童羽毛球拍儿童玩具球拍娱乐球拍批发,运动户外
吸盘毛巾架不锈钢吸盘毛巾架浴室毛巾架卫生间毛巾架,百货
雷加尔418羽毛球拍铁合金羽毛球拍练习拍羽毛球拍批发,运动户外
雷加尔718A铝合金羽毛球拍两支装训练羽毛球拍批发,运动户外
雷加尔8073羽毛球拍套装羽毛球组合套装羽毛球拍批发,运动户外
女用自慰按摩成人情趣性用品女性抽插高潮av自卫慰器震动棒舔阴器,医疗保健
雷加尔M903韩版卡通羽毛球拍儿童羽毛球拍羽毛球拍批发,运动户外
正品雷加尔MINI卡通铝合金羽毛球拍儿童羽毛球拍批发,运动户外
正品雷加尔新款卡通儿童羽毛球拍训练幼儿玩具球拍套装,运动户外
正品雷加尔新款卡通儿童羽毛球拍训练羽毛球拍羽毛球拍批发,运动户外
正品雷加尔羽毛球拍760练习球拍羽毛球拍批发,运动户外
REGAIL718A铝合金羽毛球拍两支装训练羽毛球训练拍批发,运动户外
Regail碳素羽毛球拍送球铝合金羽毛球拍家庭娱乐羽毛球拍套装,运动户外
REGAIL羽毛球拍9158情侣拍球拍羽毛球训练拍娱乐球拍一体拍,运动户外
