eq,label
男童加绒加厚毛衣中大童套头毛线衣,母婴
卡帝乐鳄鱼【10双装】袜子男短袜纯棉短筒船袜男韩版袜子女情侣浅口夏天男士低帮运动春季夏季袜 精品10,鞋包
双层不锈钢保温杯冷水杯,百货
黑鱼充电宝可爱迷你超薄个性创意苹果专用自带线移动电源3200mah,3C数码
女童毛衣套头秋冬款男童毛衣加绒加厚宝宝毛衣打底衫儿童毛衣,母婴
卡帝乐鳄鱼【5双装】男士袜子纯棉线吸汗加厚运动长袜中筒棉袜四季秋冬季款长筒袜男潮流韩版袜子男 运动二,鞋包
按摩披肩 家用颈肩背腰部揉捏颈椎按摩器,3C数码
【超值150只装】保鲜袋一次性保鲜食品袋手撕袋抽取式保鲜袋加厚食品袋冰箱保鲜袋（150只装）,百货
女手表男士学生情侣表文艺复古chic方形简约皮带韩风森系手表男女,鞋包
儿童加绒加厚毛衣4-14岁秋冬童装男童打底衫高领套头中大童针织衫,母婴
密封罐五谷杂粮储物罐（颜色随机）大号塑料厨房收纳盒食品级储物盒干货收纳罐,百货
南极人袜子男士男袜休闲商务中筒袜  混色组合装 中筒袜十双装,鞋包
1500ML保温水壶家用热水瓶子（颜色随机）不锈钢保温杯热水壶学生大容量保温瓶保温壶,百货
正品【翼颜】撕拉式去黑头鼻膜贴去螨虫粉刺收缩清洁毛孔面膜男女通用15g,美妆
南极人【5双装】羊毛袜子女秋冬季韩版毛线堆堆二杠中筒袜加厚保暖复古森系短靴袜 二杠羊毛袜 5双礼盒装,鞋包
时尚简约手表男士石英腕表个性超薄防水英伦风时装手表男,鞋包
葱花保鲜盒厨房家用姜蒜收纳盒冰箱水果便携式塑料圆形沥水密封盒,百货
老寒腿自发热保暖护膝关节炎热灸男女士四季防寒薄款中厚款老年冬,3C数码
靓丽女孩男女士香水持久留香淡香清新女性香水,美妆
南极人【2条装】加绒打底裤女袜连裤袜棉质加厚丝袜薄绒款秋冬季打底袜加厚外穿棉裤保暖裤显瘦 黑色连袜+,鞋包
精编加厚版儿童简笔画大全5000例 儿童绘画 启蒙图书学画入门教材,母婴
（5个装）食品封口夹（颜色随机）零食密封夹家用封袋夹塑料袋夹子食物封口保鲜夹,百货
【中国质造】高档防水男士手表男士石英表商务休闲腕表钢带学生,鞋包
砖石拉链款行李箱男女学生密码拉杆箱ins潮万向轮20-29寸旅行箱皮箱,鞋包
厨房15格冰箱鸡蛋保鲜盒 放鸭蛋保护托 可叠加冰箱收纳鸡蛋盒,百货
佳仁多功能捶打按摩器颈肩乐按摩披肩颈部肩部腰部捶背颈椎敲敲乐,3C数码
【水果护手霜】护手霜补水保湿滋润不油腻防冻防干裂手膜,美妆
南极人2条装加绒打底裤女秋冬季外穿连裤袜女加厚隐形丝袜踩脚裤打底袜肉色显瘦光腿神器连脚美腿棉裤一体裤,鞋包
（6件套）保鲜盖硅胶保鲜膜透明碗盖家用密封可重复通用硅胶盖食品级拉伸膜,百货
黑面膜补水保湿滋润美白收缩毛孔玻尿酸男女10片,美妆
排毒素面部排毒膏深层清洁毛孔清洁霜脸部按摩膏按摩霜去脏脸神器,美妆
金丝绒卫衣套装男秋冬季男士休闲长袖中老年外套潮流韩版运动服,男装
20oz不锈钢保温杯汽车杯冰霸杯车载水杯啤酒杯,百货
南极人保暖裤男棉裤男打底裤加绒加厚秋冬保暖内衣紧身棉毛裤绒裤弹力 黑色均码（弹力好）,鞋包
透明保鲜盒（中号）透明塑料密封罐食品收纳盒可叠加冰箱冷藏密封储物盒子,百货
【小蜜蜂】手蜡手部护理产品去死皮多余角质补水保湿嫩肤面部均可用,美妆
速冻饺子盒（颜色随机）家用饺子托盘水饺盒厨房冰箱保鲜收纳盒速冻饺子保鲜盒,百货
【生姜洗发水】老姜滋润顺滑洗发乳清爽控油温和洁净滋润顺滑滋养生姜洗发水,美妆
男士加绒保暖秋冬季休闲真皮男鞋子中老年英伦商务爸爸皮鞋男,鞋包
爆款超薄皮带手表男士日历防水石英腕表学生韩版时尚潮流休闲运动,鞋包
免洗芦荟胶面膜芦荟洗面奶套装四季补水保湿祛痘修复面霜300ml,美妆
厨房杂物密封罐 塑料五谷杂粮储物罐（透明款小号）,百货
宠物大黄梨棉绳玩具 水果系列磨牙洁齿耐咬玩具 猫狗啃咬棉绳玩具,百货
五加一便当盒带勺（颜色随机）耐热微波炉饭盒保温学生饭盒子便水果保鲜盒分格（带勺）,百货
法国瓶XO装700ml克林特伯爵白兰地洋酒酒,食品
金丝绒卫衣套装男秋冬季男士休闲长袖中老年外套潮流韩版运动服,男装
【芦荟保湿护手霜】软管芦荟保湿护手霜滋润补水改善粗糙手部润手霜,美妆
强力自粘胶带堵漏防水胶带水管补漏止漏修补带缝隙堵漏修补密封带,百货
【春节不打】小婴奇 儿童肌肤马油霜 婴儿天然马油润肤乳60g 冻疮膏脚干裂防冻止痒冻伤冬季开裂护手霜,母婴
地砖补缝剂瓷砖美缝剂防霉填缝剂勾缝剂墙面地砖专用修补工具,百货
形象美 婴儿蚕丝贴补水保湿面膜隐形粉嫩控油面膜学生女男护肤,美妆
兵哥保罗长袖衬衫男士修身保暖个性韩版衬衣2019新款冬季寸衫,男装
【蜗牛护手霜】蜗牛原液莹润保湿护手霜 直销营养滋润补水蜗牛素润手霜,美妆
【卡帝乐鳄鱼】墨镜男士太阳镜男潮偏光驾驶开车司机墨镜眼镜半框,鞋包
兵哥保罗长袖衬衫男士修身保暖个性韩版衬衣2019新款冬季寸衫,男装
7天淡化去眼袋黑眼圈去细纹紧致抗皱缓解眼疲劳补水细纹眼贴膜,美妆
按摩枕头部颈部按摩器多功能腰部电动揉捏叩击按摩仪,3C数码
兵哥保罗长袖衬衫男士修身保暖个性韩版衬衣2019新款冬季寸衫,男装
艾诗轩皇家古龙香水男士香水持久淡香清新男人味男用50ml,美妆
三头烧烤刷 18寸三头钢丝烧烤刷 钢丝 烤炉烤架清洁刷,百货
兵哥保罗长袖假两件衬衫男士修身保暖个性韩版衬衣,男装
兵哥保罗长袖假两件衬衫男士修身保暖个性韩版衬衣,男装
【美白补水面膜】亮肤美白补水面膜贴保湿控油,美妆
木杉正品墨镜男士眼镜太阳镜潮人偏光镜驾驶眼睛蛤蟆镜开车司机潮,鞋包
双USB车载点烟器车充 多颜色随机发,3C数码
桌脚垫家具防滑垫子静音脚垫桌子凳子椅子脚保护垫,百货
【热销送面膜】香三天洗发水750ml清爽去油型控油去屑止痒洗发露,美妆
小米（MI）米家小饭煲1.6L电饭煲迷你 小2人多功能智能电饭锅小容量 小米米家小饭煲 官方标配,3C数码
兵哥保罗长袖假两件衬衫男士修身保暖个性韩版衬衣,男装
Dlpoem正品男士太阳镜2018新款变色墨镜男偏光眼睛驾驶开车镜韩版,鞋包
奇美香水午夜玫瑰蕾丝持久淡香QIMEI香水100ml花香大容量香水,美妆
【买一瓶送一瓶】法国原酒葡萄酒红酒西拉干红葡萄酒波尔多AOC级,食品
兵哥保罗衬衫男秋冬季保暖长袖休闲加绒加厚青年韩版潮流衬衣,男装
时尚商务全镂空男士全自动机械表男自动机械表钢带,百货
兵哥保罗衬衫男秋冬季保暖长袖休闲加绒加厚青年韩版潮流衬衣,男装
颈椎枕按摩器颈部肩部腰部腿部脖子家用多功能按摩枕按摩靠垫,运动户外
(买一送一 )口红丝柔闪蜜唇彩口红笔1.18ml不掉色持久保湿,美妆
男士太阳镜墨镜新款太阳镜男偏光墨镜男士偏光眼镜开车司机驾驶镜,鞋包
小雏菊梦境香水淡香男女士情趣香水,美妆
充电眼部按摩仪护眼仪 触控眼部按摩器 震动眼护士眼保姆,3C数码
兵哥保罗衬衫男秋冬季保暖长袖休闲加绒加厚青年韩版潮流衬衣,男装
秒杀送礼盒皮带男自动扣男士皮带商务休闲青年学生腰带青年男裤带,鞋包
形象美 芦荟净透嫩肤面膜 补水保湿温和滋润,美妆
【素面部按摩膏】净化焕颜素面部按摩膏深层清洁去角质,美妆
兵哥保罗毛衣男新款韩版加厚冬季打底衫半圆领男士针织衫男装,男装
Dlpoem正品太阳镜男偏光镜潮人司机开车墨镜男士2018新款钓鱼眼镜,鞋包
兵哥保罗毛衣男新款韩版加厚冬季打底衫半圆领男士针织衫男装,男装
有线麦克风动圈有线话筒 分体卡侬咪KTV家用电脑移动音箱话筒,3C数码
兵哥保罗毛衣男新款韩版加厚冬季打底衫半圆领男士针织衫男装,男装
按摩器颈椎按摩器仪背部肩部腰部颈部颈肩捶背揉捏全身按摩器披肩,运动户外
眼部去细纹振动按摩美容仪美眼仪眼部按摩器美眼宝提拉紧致去皱纹,3C数码
兵哥保罗秋季男士长袖衬衫韩版修身加绒保暖商务印花大码寸衫,男装
舒赐老花镜男女时尚超轻折叠舒适简约优雅便携高清老花眼镜,鞋包
兵哥保罗秋季男士长袖衬衫韩版修身加绒保暖商务印花大码寸衫,男装
形象美 水漾幼滑舒润面膜净颜保湿嫩滑美肌单层面膜片装护肤,美妆
兵哥保罗秋季男士长袖衬衫韩版修身加绒保暖商务印花大码寸衫,男装
兵哥保罗秋季男士长袖衬衫韩版修身加绒保暖商务印花大码寸衫,男装
含棉香朵儿运动服套装女2018春秋新款学生韩版宽松休闲卫衣两件套,女装
lovehere春秋装丝绒运动套装女休闲印花真两件套韩版长袖跑步套装,女装
极限挑战3孙红雷同款眼镜男士墨镜圆脸眼睛水银色大脸复古个性,鞋包
RYRY冬季新款男士运动鞋皮面休闲跑步鞋百搭韩版男鞋子,鞋包
【1-3-5】男袜纯棉防臭吸汗条纹男士中筒袜秋冬款冬季潮冬季袜子,母婴
RYRY冬季新款马丁靴男百搭高帮皮鞋英伦工装保暖棉鞋军靴男,鞋包
韩婵 氨基酸面膜 保湿面膜 补水滋养水润嫩肤,美妆
叮咚小猴 5双装秋冬季儿童袜子 男女童小孩宝宝袜子 学生中筒棉袜,母婴
兵哥保罗秋季男士长袖衬衫韩版修身加绒保暖商务印花大码寸衫,男装
【抖音网红人手1瓶】VC爽肤水女学生补水喷雾收缩毛孔500ml,美妆
兵哥保罗秋季男士长袖衬衫韩版修身加绒保暖商务印花大码寸衫,男装
太阳镜男正品开车偏光司机墨镜男士驾车眼镜男款大框蛤蟆镜驾驶镜,鞋包
脂肪秤中文显示屏体脂称 电子体重秤人体成份分析健康秤 智能家用,3C数码
RYRY冬季新款保暖雪地靴子高帮户外休闲女鞋棉鞋,鞋包
2018新款针织防滑耐磨透气保暖中筒坡跟 雪地靴 靴子 鞋靴女,鞋包
兵哥保罗秋季男士长袖衬衫韩版修身加绒保暖商务印花大码寸衫,男装
儿童袜子秋冬款加厚加绒宝宝毛圈袜男童保暖袜女孩中筒棉袜地板袜,母婴
RYRY雪地靴女2018冬季新款高帮加绒板鞋保暖棉鞋户外休闲女鞋,鞋包
兵哥保罗保暖衬衫男加绒加厚爸爸装格子纯棉中年冬季中老年衬衣,男装
怡恩贝竹炭婴儿洗衣皂80g*5块,百货
【单棉同款】冬季加棉加绒男鞋防滑加厚休闲中老年爸爸鞋一脚蹬,鞋包
兵哥保罗保暖衬衫男加绒加厚爸爸装格子纯棉中年冬季中老年衬衣,男装
RYRY新款加绒雪地靴女加厚保暖高帮棉鞋户外休闲女鞋,鞋包
兵哥保罗保暖衬衫男加绒加厚爸爸装格子纯棉中年冬季中老年衬衣,男装
【饭后一杯 轻松降压】山楂干泡茶片无核无糖山楂片中心圈山楂干花草茶山楂茶100g包邮,食品
RYRY【多款可选】真皮羊毛皮鞋冬季新款棉鞋男加绒加厚保暖爸爸鞋商务休闲皮鞋,鞋包
儿童袜子冬季加厚加绒保暖男童女童毛圈男小孩棉秋冬厚棉冬毛巾袜,母婴
【嫩人洗面奶】V7素颜懒人水嫩洁面奶洗面奶补水滋养清洁控油洁面泡沫,美妆
老北京布鞋男鞋男单鞋橡胶底圆口鞋老布鞋老头鞋功夫鞋休闲低帮鞋,鞋包
春秋阔腿裤套装女韩版2018秋季新款气质女神范秋天时尚连体裤套装,女装
剥毛豆工具蚕豆剥皮剥壳采摘豆角铁指甲套多用不锈钢保护手指戒指,百货
RYRY抖音同款网红袜子鞋女2018新款百搭韩版街舞嘻哈女鞋潮时尚学生高帮鞋女,鞋包
【果实硕大 肉质细滑】泰国进口芒果干泰国风味皇家皇冠满果干休闲零食组合果干包邮,食品
德国精工4D男士浮动三刀头剃胡刀电动剃须刀充电式刮胡刀刮须刀,运动户外
（一包4个）床单固定器床垫防滑夹固定扣床笠固定夹子防跑松紧带床夹子,百货
秋冬季女加厚加大秋冬法兰绒长袖睡衣珊瑚绒家居服套装,女装
【加绒加厚】2019升级版冲锋衣男女同款加绒加厚秋冬大码棉衣户外冲锋衣,男装
空调挡风板月子婴幼儿防直吹导风罩出风口挡板遮风板挂机空调挡板,百货
【北极绒正品】法兰绒套装家居服睡衣女秋冬加厚珊瑚绒韩大码套装,女装
【锁温保暖】男鞋棉冬季新款加绒加厚保暖棉鞋防滑男士休闲冬棉鞋,鞋包
【保湿补水面膜】玻尿酸面膜保湿补水面膜睡眠免洗面膜,美妆
家用不锈钢取杯器粘胶式一次性纸杯收纳架饮水机塑料水杯架杯子架（不锈钢本色）,百货
【指甲刀19件套】指甲剪指甲钳锉刀粉刺针毛剪掏耳勺修脚刀,百货
2-14岁儿童纯棉内衣套装中大童秋冬秋衣秋裤男童女童薄款长袖睡衣,母婴
秋冬季卫衣休闲百搭男士运动套装棒球领长袖男装,男装
【保湿面膜】8杯水保湿细滑天丝面膜滋养嫩肤八杯水,美妆
【送枸杞】解酒护肝千杯不醉增酒量喝不脸红醒酒药神器葛根解酒护肝60粒/瓶,食品
老北京布鞋男鞋平底鞋黑色相巾工作鞋爸爸鞋酒店鞋上班鞋黑底防滑,鞋包
加绒公牛中学生连帽运动套装冬季保暖男卫衣外贸男装,男装
电子称手提电子秤50kg准确迷你便携高精度家用手拿行李快递称小秤,百货
万向轮拉链行李箱防刮耐撞升级版铝框旅行箱男女学生密码拉杆箱,鞋包
【嫩滑香体乳】嫩滑香体乳身体乳补水保湿控油去角质去鸡皮全身滋润,美妆
维密女王日韩森林萌学生女士香水便携少女茉莉持久留香30ml,美妆
一枝春 玫瑰丝滑幼嫩面膜 补水保湿滋润柔嫩收缩毛孔嫩滑美肌面膜,美妆
秋冬加绒男士外贸卫衣运动休闲男士开衫,男装
儿童内衣套装纯棉宝宝秋衣秋裤0-7岁男童女童睡衣婴儿衣服春秋装,母婴
APPLE苹果男鞋新款男士网面休闲鞋透气防臭网鞋男学生运动鞋子,鞋包
【去屑洗发水】柔顺亮滑香水洗发露去屑柔顺清爽控油护法止痒洗发水美发,美妆
瓜子钳加厚不锈钢松子夹多功能剪刀家用钳子嗑葵花籽西瓜子剥壳器,百货
2018秋冬新款韩版修身毛衣包臀短裙套装女蝴蝶针织连衣裙两件套潮,女装
蓓罗莎加大浴巾,百货
【酷伊人】加绒仿牛仔裤韩版学生裤子中高腰黑色女小脚裤铅笔长裤,女装
秋冬季男士休闲裤商务直筒中年人男裤加绒加厚长裤子爸爸装40岁50,男装
马卡龙色系毛毛室内居家保暖木地板加厚棉拖鞋秋冬男女情侣拖,鞋包
秋冬新款男士运动加绒套装休闲长袖棒球服外装中学生男健身卫衣,男装
春秋新款男鞋厚底老北京布鞋男款单鞋韩版学院风潮流百搭运动xx鞋,鞋包
南极人儿童保暖内衣套装冬秋衣秋裤加绒加厚男童女童婴儿宝宝童装,母婴
【马油脚气膏】马油脚气膏去脚气止痒脱皮水泡糜烂脚汗脚臭神器泡脚药足光粉,美妆
狗狗梳子猫咪刷子狗毛刷狗毛清理器金茂泰迪比熊中小型犬用品针梳,百货
表白浴巾,百货
新款法拉利加绒卫衣男运动连帽冬季套装时尚长袖青少年外套,男装
【开车必备 直视路面】汽车用车载手机支架仪表台出风口导航支架,3C数码
多功能羊角锤便携式小巧便携工具实心一体铁榔头家用小锤子锤榔头,百货
南极人岛国风情浴巾,百货
伊多郡新款秋冬针织开衫外套女中长款韩版宽松加厚学生百搭毛衣女,女装
南极人都市蜂巢浴巾,百货
四季中老年男鞋爸爸鞋中年男士休闲软底防滑老人男单鞋老北京布鞋,鞋包
2018新款冬季耳罩加厚保暖耳套男耳包女耳暖韩版耳捂,鞋包
有友泡凤爪 酸菜味泡凤爪100g*5袋,食品
【4条装限时秒杀】纯棉毛巾 素色洗脸毛巾 超强吸水毛巾,百货
南极人风尚浴巾,百货
中大童加绒加厚保暖内衣套装秋衣秋裤儿童冬季男童女童装宝宝小孩,母婴
有友泡凤爪 山椒味泡凤爪100g*5袋,食品
南极人格调浴巾,百货
针织开衫女2018秋冬新款中长款加厚宽松毛衣外套过膝慵懒风外搭潮,女装
冬季男鞋加绒保暖加厚棉鞋男士休闲鞋韩版潮流青年板鞋防水皮鞋男,鞋包
【美白面膜】滋润美白面膜片装海藻补水蚕丝蛋白保湿面膜秋冬,美妆
南极人格子浴巾,百货
新款儿童保暖内衣加绒加厚套装男女童秋衣秋裤中大童冬季宝宝睡衣,母婴
【全身加绒】衬衫女冬新款长袖韩版修身保暖印花白色衬衫女打底衫,女装
有友笋尖 泡椒味笋尖100g*5袋,食品
【台湾进口】妙管家去油地板清洁剂家用厨房地面瓷砖强力去污柠檬味,百货
【限时特价】双丝带长城毛巾 成人儿童擦手洗脸毛巾 擦手巾,百货
老北京布鞋男冬季老人鞋保暖棉鞋子加绒加厚中老年爸爸鞋防滑男鞋,鞋包
加厚开叉针织半身裙包臀一步裙女中长款2018秋冬新款长裙毛线裙子,女装
南极人极简风尚浴巾,百货
【面膜清洁】玉容撕拉面膜去黑头去粉刺收缩毛孔鼻膜鼻贴面部清洁,美妆
明治meiji 雪吻巧克力 33g*4盒 四口味各一盒,食品
连帽卫衣女学生加绒2018新款韩版冬季宽松上衣加厚显瘦短外套女装,女装
【限时特价】双丝带长城毛巾 成人儿童擦手洗脸毛巾 擦手巾,百货
加绒加厚打底裤女外穿秋冬款韩版仿牛仔裤小脚裤修身显瘦高腰女裤,女装
情趣内衣激情套装骚制服诱惑性感蕾丝袜JK装女仆护士服装空姐sm女,女装
明治meiji 雪吻巧克力 精选礼盒180g/盒,食品
新款老北京运动底棉布鞋男鞋休闲鞋鞋男老北京厚底耐磨防臭工作鞋,鞋包
【收藏T裤】性感睡衣女夏季透明蕾丝制服诱惑露背情趣内衣v领睡裙,女装
明治meiji 澳洲坚果夹心巧克力 精装礼盒180g/盒,食品
南极人剪春浴巾,百货
【加绒-不加绒】大红色牛仔裤女小脚裤新款加厚铅笔裤长裤秋冬款,女装
情趣内衣女骚成人制服极度诱惑角色性感透视空姐学生护士内裤套装,女装
南极人井田浴巾,百货
情趣内衣女蕾丝绣花吊带露胸透视装睡裙连体衣制服女士激情套装骚,女装
男士加绒保暖秋冬季休闲真皮男鞋子中老年英伦商务爸爸皮鞋男,鞋包
【单棉同款】冬季加棉加绒男鞋防滑加厚休闲中老年爸爸鞋一脚蹬,鞋包
足浴工作服套装女技师酒店前台职业套装桑拿按摩店工装性感制服秋,女装
户外防水手套冬季触屏男女防风保暖骑行全指拉链运动加绒登山滑雪,鞋包
【限量秒杀】 抖音同款指纹打火机充电创意防风USB电子点烟器个性定制潮送男友,百货
日系甜美水手服学院风校服班服JK制服女高校软妹百褶裙长裙半身裙,女装
【限时特价包邮】JBL flip3蓝牙音箱收纳盒 保护套可放数据线充电器,百货
抖音香水女士持久淡香清新自然学生同款网红香体喷雾100ml,美妆
可口可乐 零度 无糖零卡 汽水 碳酸饮料 330ml*24罐 整箱,食品
明治meiji 巴旦木夹心巧克力 精选礼盒装225g/盒,食品
可口可乐（Coca-Cola）无糖组合 零卡雪碧 330ml*24罐 碳酸饮料,食品
浪莎 男士纯棉秋冬季黑色商务全棉男袜防臭中筒袜厚短袜吸汗棉袜 黑色8双礼盒装,鞋包
冬季男鞋加绒保暖加厚棉鞋男士休闲鞋韩版潮流青年板鞋防水皮鞋男,鞋包
【买二送一】【秒杀亏200件】健身减肥跳跳球大人儿童玩具,运动户外
西铂脸部面部丝滑去角质素深层清洁净洗磨砂膏去死皮温和不去水,美妆
宠物玩具 手拉式长尾球玩具 宠物棉绳玩具 狗玩具手拉球,百货
露兰姿珍爱车载香水 香氛车用香水 留香 60ml,美妆
维他奶 维他柠檬茶饮料整箱装,食品
泉兮正品芦荟胶大容量220g 祛痘淡痘印补水保湿晒后修复免洗面膜,美妆
韩国学生长款毛绒白色保暖围巾女春秋冬季韩版百搭獭兔毛围脖套头,鞋包
四合一大容量泡脚药包艾叶红花老姜益母草驱寒祛湿助眠泡澡药包,美妆
雪碧 Sprite 柠檬味 汽水 碳酸饮料  整箱装 迷你摩登罐 可口可乐公司出品,食品
干烧电子烟 烟草 烤烟蒸发器,百货
六胜肽去皱纹抗皱纹精华液青春定格毛孔收缩面部精华原液,美妆
三牛万年青饼干香葱味咸味 上海特产休闲零食早餐小吃点心内含独立小包装 万年青 1500g,食品
泉兮海盐火山沐浴泥沐浴盐身体搓泥沐浴露250ML/瓶,美妆
南极人良品生活浴巾,百货
【轻松一滴 拯救秀发】洛黛诗护发精油 摩洛哥坚果油 免洗护发素发尾油营养水精华素50ML,美妆
闲趣 散装饼干3KG整箱优冠牛奶香脆夹心早餐饼干办公室下午茶点心 闲趣原味,食品
民族风秋冬仿羊绒保暖围巾女两用大披肩复古刺绣带帽斗篷,鞋包
宏源 陈皮糖 硬糖婚庆糖喜糖 888g/袋,食品
赛鹏鞋子男韩版潮流休闲皮鞋一脚蹬男鞋秋冬学生运动棉鞋男士N21,鞋包
南极人菱格浴巾,百货
大白兔奶油话梅糖 糖果,食品
南极人磨毛浴巾,百货
大白兔奶糖 糖果,食品
一喷除口臭 舒客舒克除口臭口气喷雾剂口喷 去口臭口气清新剂18ml,美妆
制服制度女仆装情趣内衣女开档露乳睡衣性感极度诱惑sm骚激情套装,女装
【加绒VS不加绒】秋冬季新款男鞋运动休闲鞋子韩版百搭男士板鞋潮,鞋包
泉兮清滢懒人V7素颜霜提亮肤色素颜霜补水保湿裸妆遮瑕霜50g正品,美妆
Maxdonas新品邂逅特调持久清新淡香女士香水香氛,美妆
情趣内衣性感极度诱惑制服夜店雪纺睡衣女夏透明印花和服睡袍,女装
宝路薄荷味糖750g,食品
XY01 迷你蓝牙耳机oppo华为vivo无线通用耳机 便携带耳机,3C数码
情趣内衣内裤学生空姐女仆秘书诱惑成人丝袜女冬薄情趣制服套装骚,女装
康师傅 方便面 鲜虾鱼板桶面 102g*12桶 泡面整箱装,食品
外贸男用喷雾香水清新持久诱惑香氛古龙男士香,美妆
【亏本大促】秋冬季男士皮鞋商务休闲男鞋子爸爸鞋加绒棉鞋男鞋,鞋包
花田美芙草本祛痘膏乳30g 去粉刺痘痘青春痘祛痘印,美妆
2018现货韩版格子围巾男女士秋冬季学生款百搭披肩两用纯色仿羊绒,鞋包
南极人墨竹浴巾,百货
形象美 玻尿酸原液面膜 补水保湿控油面膜 面部护理护肤,美妆
【男人三宝】超划算 组合套装 淫羊藿+玛咖+牡蛎 成人正品 淫羊藿60粒 玛咖60片 牡蛎60片,医疗保健
致奇原姜防脱生发控油柔顺洗发水原生姜发膜护发素,百货
健美创研新款花果香调香水30ml持久淡香水清新淡雅,美妆
舒适耐磨男鞋加毛加厚棉鞋休闲透气布鞋牢固耐穿工装鞋软底板鞋男,鞋包
【限时特价】双丝带长城毛巾 成人儿童擦手洗脸毛巾 擦手巾,百货
梦希蓝香馜金桂花眼膜贴保湿去眼袋眼纹140g/80片舒缓眼部护理,美妆
男士百搭围巾冬季新款学生保暖格子围巾男潮韩版围巾男,鞋包
欧佩【3秒去角质 还你婴儿嫩肤】全身温和去角质死皮,美妆
【7天去脚气】金泰康康足搭档【浓缩型】足部调理乳膏30g+喷脚净50ml手足痒脱皮糜烂止痒,美妆
ns超火裤子加绒加厚女黑色破洞高腰牛仔裤女九分裤弹力修身铅笔裤,女装
形象美男士控油保湿炭泥洗面奶清爽洁净洁面乳洁面产品护肤品,美妆
【日销千件今日清仓】花花公子贵宾正品男鞋四季休闲运动跑步鞋,鞋包
拖把架家居用品拖把架 多功能拖把挂架带挂钩 魔术拖把架,百货
含棉香朵儿运动服套装女2018春秋新款学生韩版宽松休闲卫衣两件套,女装
【秋冬去角质神器 3秒去除角质 还你婴儿肌】全身温和去角质啫喱160g,美妆
lovehere春秋装丝绒运动套装女休闲印花真两件套韩版长袖跑步套装,女装
泊泉雅清透修颜水粉霜 BB霜粉底液补水保湿遮瑕隔离霜bb霜,美妆
秋冬仿狐狸毛外套女新娘披肩斗篷显瘦仿水貂裘皮中长款特价,女装
30*100cm降温神器冷感冰巾冰感运动毛巾健身房吸汗冰巾凉感巾,百货
羽绒棉马甲女秋冬韩版短款学生面包服马夹坎肩背心立领坎肩外套,女装
美容师足浴足疗技师服夜店性感套装空姐制服诱惑桑拿酒店工作服女,女装
网鞋男夏季透气耐磨运动鞋休闲跑步鞋男士韩版镂空网面飞织鞋男鞋,鞋包
情趣内衣制服优雅提花假式连体衣开裆连身袜丝袜外贸新款女性成人用品,医疗保健
【三防必备】万痛筋骨贴（20贴装） 消炎止痛 消肿止痛 腰肌损伤 韧带拉伤,百货
短款棉衣女秋冬时尚百搭小香风轻薄短装棉服加厚外套小棉袄大码,女装
足浴技师服女 沐足桑拿洗浴KTV空姐制服套装 酒店按摩 足疗工作服,女装
68棉不加绒-加绒加厚牛仔裤女韩版显瘦冬季高腰弹力大码小脚裤子,女装
沐足技师工衣女酒店工作服套装桑拿足浴制服足浴足疗技师工作服女,女装
新款夏季夜店KTV公主空姐制服足浴技师工作服足疗按摩桑拿工衣女,女装
单棉同款花花公子国际公司PLAYYOUNG秋冬男鞋百搭休闲运动跑步鞋,鞋包
